{
  "schema": "foldstate/1",
  "id": "generated",
  "context": { "n": 0 },
  "ignore": ["c", "tick.*"],
  "max_microsteps": 40,
  "root": {
    "id": "root",
    "kind": "compound",
    "initial": "s5",
    "states": [
      {
        "id": "s1",
        "kind": "compound",
        "states": [
          {
            "id": "s2",
            "on": [
              {
                "event": "a",
                "target": ["#s5.s6"],
                "actions": [
                  { "emit": { "name": "e2", "params": { "ctx": "/n" } } }
                ]
              },
              { "event": "a a.x", "target": ["#s1.s3"] },
              {
                "event": "i",
                "actions": [
                  {
                    "assign": {
                      "path": "/n",
                      "value": { "add": [{ "ctx": "/n" }, { "lit": 1 }] }
                    }
                  },
                  { "raise": { "event": "d" } }
                ]
              }
            ]
          },
          { "id": "s3", "kind": "final" },
          {
            "id": "s4",
            "kind": "final",
            "entry": [
              {
                "assign": {
                  "path": "/seen/x",
                  "value": { "sub": [{ "ctx": "/n" }, { "lit": 0.5 }] }
                }
              }
            ],
            "tags": ["tagged"]
          }
        ],
        "on": [
          {
            "event": "c",
            "target": ["#s1.s4"],
            "actions": [
              {
                "assign": {
                  "path": "/n",
                  "value": { "add": [{ "ctx": "/n" }, { "lit": 1 }] }
                }
              },
              { "emit": { "name": "e1" } }
            ]
          }
        ]
      },
      {
        "id": "s5",
        "kind": "parallel",
        "states": [
          {
            "id": "s6",
            "on": [
              {
                "event": "a.*",
                "target": ["#s1.s2"],
                "actions": [
                  { "assign": { "path": "/last", "value": { "event": "/v" } } }
                ]
              },
              {
                "event": "c",
                "guard": { "in": "#s1.s3" },
                "target": ["#s5.s7"],
                "actions": [
                  { "emit": { "name": "e0", "params": { "ctx": "/n" } } }
                ]
              },
              {
                "guard": {
                  "cmp": {
                    "left": { "ctx": "/n" },
                    "op": "lt",
                    "right": { "lit": 3 }
                  }
                },
                "target": ["#s1"],
                "actions": [
                  {
                    "assign": {
                      "path": "/n",
                      "value": { "add": [{ "ctx": "/n" }, { "lit": 1 }] }
                    }
                  },
                  {
                    "schedule": { "id": "t1", "event": "tick", "delay_ms": 30 }
                  },
                  {
                    "assign": {
                      "path": "/n",
                      "value": { "add": [{ "ctx": "/n" }, { "lit": 1 }] }
                    }
                  }
                ]
              }
            ]
          },
          {
            "id": "s7",
            "on": [{ "event": "a.*", "target": ["#s5"] }],
            "after": [
              {
                "delay_ms": 100,
                "target": ["#s5.s6"],
                "actions": [
                  { "assign": { "path": "/last", "value": { "event": "/v" } } }
                ]
              }
            ]
          }
        ],
        "on": [
          {
            "guard": {
              "cmp": {
                "left": { "ctx": "/n" },
                "op": "lt",
                "right": { "lit": 5 }
              }
            },
            "target": ["#s1"],
            "internal": true,
            "actions": [
              {
                "assign": {
                  "path": "/n",
                  "value": { "add": [{ "ctx": "/n" }, { "lit": 1 }] }
                }
              },
              { "emit": { "name": "e0" } }
            ]
          },
          {
            "event": "c",
            "guard": {
              "any": [
                { "named": { "name": "even" } },
                {
                  "cmp": {
                    "left": { "ctx": "/n" },
                    "op": "eq",
                    "right": { "lit": 0 }
                  }
                }
              ]
            },
            "target": ["#s5"],
            "actions": [
              {
                "assign": {
                  "path": "/n",
                  "value": { "add": [{ "ctx": "/n" }, { "lit": 1 }] }
                }
              },
              {
                "assign": {
                  "path": "/n",
                  "value": { "add": [{ "ctx": "/n" }, { "lit": 1 }] }
                }
              }
            ]
          }
        ],
        "entry": [{ "schedule": { "id": "t0", "event": "a", "delay_ms": 40 } }]
      }
    ],
    "on": [{ "event": "d", "target": ["#s1.s2"] }]
  }
}
