{
  "schema": "foldstate/1",
  "id": "generated",
  "context": { "n": 0 },
  "unhandled": "ignore",
  "max_microsteps": 40,
  "root": {
    "id": "root",
    "kind": "compound",
    "initial": "s2",
    "states": [
      { "id": "s1", "kind": "final" },
      {
        "id": "s2",
        "kind": "compound",
        "initial": "s3",
        "states": [
          { "id": "s3" },
          { "id": "s4" },
          {
            "id": "s5",
            "on": [
              {
                "event": "b",
                "target": ["#s6"],
                "actions": [
                  {
                    "assign": {
                      "path": "/big",
                      "value": { "mul": [{ "lit": 1e200 }, { "lit": 1e200 }] }
                    }
                  }
                ]
              },
              { "event": "a", "target": ["#s6"] },
              {
                "event": "c",
                "guard": { "in": "#s1" },
                "target": ["#s2.s4"],
                "actions": [
                  {
                    "assign": {
                      "path": "/n",
                      "value": { "add": [{ "ctx": "/n" }, { "lit": 1 }] }
                    }
                  }
                ]
              }
            ]
          }
        ],
        "on": [
          {
            "event": "a.x",
            "target": ["#s2.s4"],
            "actions": [
              { "assign": { "path": "/last", "value": { "event": "/v" } } },
              { "emit": { "name": "e1" } }
            ]
          },
          {
            "event": "done.state.*",
            "target": ["#s2"],
            "internal": true,
            "actions": [
              { "schedule": { "id": "t1", "event": "tick", "delay_ms": 30 } }
            ]
          }
        ]
      },
      { "id": "s7", "kind": "history", "deep": true },
      {
        "id": "s6",
        "on": [
          { "event": "c c", "guard": { "in": "#s7" }, "target": ["#s2.s3"] },
          {
            "event": "d",
            "target": ["#s2"],
            "internal": true,
            "actions": [
              { "assign": { "path": "/last", "value": { "event": "/v" } } }
            ]
          },
          { "event": "a.x", "target": ["#s1"] }
        ]
      }
    ]
  }
}
