{
  "schema": "foldstate/1",
  "id": "generated",
  "context": { "n": 0 },
  "unhandled": "ignore",
  "max_microsteps": 40,
  "root": {
    "id": "root",
    "kind": "parallel",
    "states": [
      {
        "id": "s1",
        "kind": "parallel",
        "states": [
          {
            "id": "s2",
            "on": [
              { "event": "c", "target": ["#s5"] },
              {
                "event": "a",
                "target": ["#s5"],
                "actions": [
                  { "emit": { "name": "e2", "params": { "ctx": "/n" } } }
                ]
              }
            ]
          },
          {
            "id": "s3",
            "on": [
              {
                "event": "b",
                "target": ["#s1.s4"],
                "actions": [
                  { "schedule": { "id": "t0", "event": "a", "delay_ms": 0 } }
                ]
              }
            ],
            "after": [
              {
                "delay_ms": 100,
                "id": "after-s1.s3",
                "target": ["#s1.s3"],
                "actions": [{ "emit": { "name": "e1" } }]
              }
            ],
            "entry": [
              {
                "raise": { "event": "c", "data": { "lit": { "v": "raised" } } }
              },
              { "schedule": { "id": "t0", "event": "b", "delay_ms": 30 } }
            ]
          },
          {
            "id": "s4",
            "on": [
              {
                "event": "c",
                "guard": {
                  "cmp": {
                    "left": { "ctx": "/n" },
                    "op": "ne",
                    "right": { "lit": 1 }
                  }
                },
                "target": ["#s1.s2"],
                "internal": true
              }
            ]
          }
        ]
      },
      { "id": "s5" },
      {
        "id": "s6",
        "on": [
          {
            "event": "a",
            "guard": {
              "cmp": {
                "left": { "ctx": "/n" },
                "op": "lt",
                "right": { "lit": 2 }
              }
            },
            "target": ["#s1.s4"]
          },
          {
            "event": "b",
            "guard": {
              "cmp": {
                "left": { "add": [{ "ctx": "/last" }, { "lit": 1 }] },
                "op": "gt",
                "right": { "lit": 1 }
              }
            },
            "target": ["#s1.s2"],
            "actions": [
              {
                "assign": {
                  "path": "/n",
                  "value": { "add": [{ "ctx": "/n" }, { "lit": 1 }] }
                }
              }
            ]
          },
          {
            "guard": {
              "cmp": {
                "left": { "ctx": "/n" },
                "op": "lt",
                "right": { "lit": 3 }
              }
            },
            "target": ["#s1.s2"],
            "internal": true,
            "actions": [
              {
                "assign": {
                  "path": "/n",
                  "value": { "add": [{ "ctx": "/n" }, { "lit": 1 }] }
                }
              },
              { "emit": { "name": "e2" } },
              { "cancel": { "id": "t0" } }
            ]
          }
        ]
      }
    ]
  }
}
