{"schema":"foldstate/1","id":"generated","context":{"n":0},"ignore":["c","tick.*"],"max_microsteps":40,"root":{"id":"root","kind":"compound","initial":"s2","states":[{"id":"s1","on":[{"event":"a","target":["#s1"],"actions":[{"assign":{"path":"/seen/y~0","value":{"sub":[{"ctx":"/n"},{"lit":0.5}]}}}]}],"entry":[{"raise":{"event":"c"}},{"raise":{"event":"i.j"}}]},{"id":"s2","kind":"final"},{"id":"s3","on":[{"event":"b","target":["#s3"],"actions":[{"assign":{"path":"/n","value":{"add":[{"ctx":"/n"},{"lit":1}]}}}]},{"event":"done.state.*","guard":{"cmp":{"left":{"ctx":"/n"},"op":"lt","right":{"lit":2}}},"target":["#s1"],"actions":[{"assign":{"path":"/seen/x","value":{"sub":[{"ctx":"/n"},{"lit":0.5}]}}}]},{"event":"i","guard":{"cmp":{"left":{"ctx":"/n"},"op":"ne","right":{"lit":3}}},"target":["#s1"],"actions":[{"assign":{"path":"/n","value":{"mul":[{"ctx":"/n"},{"lit":3037000500}]}}},{"assign":{"path":"/seen/z~1w","value":{"sub":[{"ctx":"/n"},{"lit":0.5}]}}}]}]}],"entry":[{"raise":{"event":"i","data":{"lit":{"v":"raised"}}}}]}}