{"schema":"foldstate/1","id":"generated","context":{"n":0},"unhandled":"ignore","max_microsteps":40,"root":{"id":"root","kind":"parallel","states":[{"id":"s1","on":[{"event":"a.x","guard":{"not":{"in":"#s1"}},"target":["#s2.s3.s5"]},{"event":"a a","target":["#s2.s3"],"actions":[{"assign":{"path":"/n","value":{"add":[{"ctx":"/n"},{"lit":1}]}}}]}],"exit":[{"assign":{"path":"/n","value":{"add":[{"ctx":"/n"},{"lit":1}]}}}]},{"id":"s2","kind":"parallel","states":[{"id":"s3","kind":"compound","states":[{"id":"s4","on":[{"event":"a.x","guard":{"in":"#s2"},"target":["#s2.s7.s9"],"internal":true,"actions":[{"assign":{"path":"/n","value":{"add":[{"ctx":"/n"},{"lit":1}]}}}]}]},{"id":"s5"}],"exit":[{"assign":{"path":"/n","value":{"add":[{"ctx":"/n"},{"lit":1}]}}}]},{"id":"s6","entry":[{"schedule":{"id":"t2","event":"a","delay_ms":10}},{"assign":{"path":"/n","value":{"add":[{"ctx":"/n"},{"lit":1}]}}}]},{"id":"s7","kind":"compound","states":[{"id":"s8","on":[{"event":"a.x","target":["#s2.s6","#s2.s7"],"internal":true,"actions":[{"assign":{"path":"/n","value":{"add":[{"ctx":"/n"},{"lit":1}]}}}]}]},{"id":"s9","on":[{"guard":{"in":"#s2.s7.s9"},"target":["#s1"],"actions":[{"assign":{"path":"/seen/y~0","value":{"sub":[{"ctx":"/n"},{"lit":0.5}]}}},{"emit":{"name":"e1","params":{"ctx":"/n"}}}]}]}],"entry":[{"assign":{"path":"/last","value":{"event":"/v"}}},{"assign":{"path":"/n","value":{"add":[{"ctx":"/n"},{"lit":1}]}}}]}],"on":[{"event":"*","target":["#s2"],"internal":true},{"event":"done.state.*","target":["#s2.s6"]}]}],"on":[{"event":"*","target":["#s2.s6"]}]}}