{
  "schema": "foldstate/1",
  "id": "generated",
  "context": { "n": 0 },
  "max_microsteps": 40,
  "root": {
    "id": "root",
    "kind": "compound",
    "initial": "s5",
    "states": [
      {
        "id": "s1",
        "kind": "compound",
        "initial": "s3",
        "states": [
          {
            "id": "s2",
            "on": [
              {
                "event": "d",
                "guard": { "not": { "in": "#s6.s11" } },
                "target": ["#s6.s15.s17"],
                "actions": [
                  {
                    "assign": {
                      "path": "/n",
                      "value": { "add": [{ "ctx": "/n" }, { "lit": 1 }] }
                    }
                  },
                  { "cancel": { "id": "t0" } }
                ]
              }
            ],
            "entry": [
              { "emit": { "name": "e0" } },
              { "cancel": { "id": "t0" } }
            ]
          },
          {
            "id": "s3",
            "on": [
              {
                "event": "b",
                "target": ["#s6.s11.s12"],
                "internal": true,
                "actions": [
                  { "emit": { "name": "e0" } },
                  { "assign": { "path": "/last", "value": { "event": "/v" } } }
                ]
              },
              { "event": "d", "target": ["#s6.s7"] }
            ],
            "after": [{ "delay_ms": 100, "target": ["#s6.s11.s12"] }]
          },
          { "id": "s4" }
        ],
        "on": [{ "event": "b a", "guard": { "in": "#s6" }, "target": ["#s6"] }]
      },
      { "id": "s5", "kind": "final" },
      {
        "id": "s6",
        "kind": "parallel",
        "states": [
          {
            "id": "s7",
            "kind": "parallel",
            "states": [
              {
                "id": "s8",
                "on": [
                  {
                    "event": "b",
                    "guard": { "in": "#s6.s15" },
                    "target": ["#s1.s3"],
                    "actions": [
                      { "raise": { "event": "b" } },
                      {
                        "assign": {
                          "path": "/n",
                          "value": {
                            "mul": [{ "ctx": "/n" }, { "lit": 3037000500 }]
                          }
                        }
                      }
                    ]
                  }
                ]
              },
              {
                "id": "s9",
                "on": [
                  {
                    "event": "a.x",
                    "target": ["#s6.s11"],
                    "actions": [
                      {
                        "assign": {
                          "path": "/n",
                          "value": { "add": [{ "ctx": "/n" }, { "lit": 1 }] }
                        }
                      }
                    ]
                  }
                ]
              },
              { "id": "s10" }
            ]
          },
          {
            "id": "s11",
            "kind": "compound",
            "initial": "s13",
            "states": [
              { "id": "s12" },
              {
                "id": "s13",
                "on": [
                  {
                    "guard": {
                      "cmp": {
                        "left": { "ctx": "/n" },
                        "op": "lt",
                        "right": { "lit": 5 }
                      }
                    },
                    "target": ["#s6.s7.s10"],
                    "actions": [
                      {
                        "assign": {
                          "path": "/n",
                          "value": { "add": [{ "ctx": "/n" }, { "lit": 1 }] }
                        }
                      },
                      {
                        "schedule": {
                          "id": "t0",
                          "event": "tick",
                          "delay_ms": 30
                        }
                      },
                      {
                        "schedule": {
                          "id": "t2",
                          "event": "tick",
                          "delay_ms": 40
                        }
                      }
                    ]
                  },
                  {
                    "event": "d",
                    "target": ["#s6.s7.s9"],
                    "internal": true,
                    "actions": [
                      { "emit": { "name": "e0" } },
                      {
                        "assign": {
                          "path": "/n",
                          "value": { "add": [{ "ctx": "/n" }, { "lit": 1 }] }
                        }
                      }
                    ]
                  }
                ]
              },
              { "id": "s14" }
            ],
            "exit": [
              {
                "assign": {
                  "path": "/n",
                  "value": { "add": [{ "ctx": "/n" }, { "lit": 1 }] }
                }
              },
              { "raise": { "event": "d" } }
            ]
          },
          {
            "id": "s15",
            "kind": "compound",
            "initial": "s17",
            "states": [
              {
                "id": "s16",
                "on": [
                  {
                    "event": "b",
                    "guard": { "in": "#s6.s15.s16" },
                    "target": ["#s6.s15.s17"],
                    "actions": [
                      {
                        "raise": {
                          "event": "a",
                          "data": { "lit": { "v": "raised" } }
                        }
                      }
                    ]
                  },
                  { "event": "c", "target": ["#s6.s11.s14"] },
                  {
                    "guard": {
                      "cmp": {
                        "left": { "ctx": "/n" },
                        "op": "lt",
                        "right": { "lit": 5 }
                      }
                    },
                    "target": ["#s6.s7.s10"],
                    "actions": [
                      {
                        "assign": {
                          "path": "/n",
                          "value": { "add": [{ "ctx": "/n" }, { "lit": 1 }] }
                        }
                      },
                      { "cancel": { "id": "t1" } },
                      { "raise": { "event": "b" } }
                    ]
                  }
                ],
                "after": [{ "delay_ms": 100, "target": ["#s1.s3"] }]
              },
              {
                "id": "s17",
                "kind": "final",
                "exit": [
                  {
                    "assign": {
                      "path": "/n",
                      "value": { "add": [{ "ctx": "/n" }, { "lit": 1 }] }
                    }
                  }
                ]
              }
            ],
            "on": [
              {
                "guard": {
                  "cmp": {
                    "left": { "ctx": "/n" },
                    "op": "lt",
                    "right": { "lit": 0 }
                  }
                },
                "target": ["#s6.s11.s14"],
                "actions": [
                  {
                    "assign": {
                      "path": "/n",
                      "value": { "add": [{ "ctx": "/n" }, { "lit": 1 }] }
                    }
                  },
                  {
                    "assign": {
                      "path": "/n",
                      "value": {
                        "mul": [{ "ctx": "/n" }, { "lit": 3037000500 }]
                      }
                    }
                  }
                ]
              }
            ],
            "invoke": [{ "name": "job" }]
          }
        ],
        "on": [
          {
            "event": "c",
            "target": ["#s6.s11.s13"],
            "actions": [
              { "schedule": { "id": "t0", "event": "a", "delay_ms": 20 } },
              { "assign": { "path": "/last", "value": { "event": "/v" } } }
            ]
          },
          {
            "event": "a.*",
            "guard": { "in": "#s1.s2" },
            "target": ["#s1"],
            "internal": true,
            "actions": [
              {
                "raise": { "event": "b", "data": { "lit": { "v": "raised" } } }
              },
              {
                "assign": {
                  "path": "/n",
                  "value": { "add": [{ "ctx": "/n" }, { "lit": 1 }] }
                }
              }
            ]
          }
        ]
      }
    ],
    "invoke": [{ "name": "job" }]
  }
}
