{"schema":"foldstate/1","id":"generated","context":{"n":0},"max_microsteps":40,"root":{"id":"root","kind":"parallel","states":[{"id":"s1","on":[{"event":"a","target":["#s1"],"actions":[{"assign":{"path":"/seen/z~1w","value":{"sub":[{"ctx":"/n"},{"lit":0.5}]}}},{"assign":{"path":"/n","value":{"add":[{"ctx":"/n"},{"lit":1}]}}}]}],"entry":[{"raise":{"event":"b"}}]},{"id":"s2","on":[{"event":"b","target":["#s1"],"internal":true,"actions":[{"raise":{"event":"b","data":{"lit":{"v":"raised"}}}}]},{"guard":{"cmp":{"left":{"ctx":"/n"},"op":"lt","right":{"lit":4}}},"target":["#s2"],"actions":[{"assign":{"path":"/n","value":{"add":[{"ctx":"/n"},{"lit":1}]}}},{"assign":{"path":"/last","value":{"event":"/v"}}},{"emit":{"name":"e2","params":{"ctx":"/n"}}}]}],"tags":["tagged"]}],"on":[{"event":"i","target":["#s1"],"actions":[{"assign":{"path":"/n","value":{"add":[{"ctx":"/n"},{"lit":1}]}}},{"raise":{"event":"b","data":{"lit":{"v":"raised"}}}}]}]}}