{
  "schema": "foldstate/1",
  "id": "generated",
  "context": { "n": 0 },
  "ignore": ["c", "tick.*"],
  "max_microsteps": 40,
  "root": {
    "id": "root",
    "kind": "compound",
    "initial": "s1",
    "states": [
      {
        "id": "s1",
        "kind": "compound",
        "states": [
          {
            "id": "s2",
            "on": [
              { "event": "*", "target": ["#s1"] },
              { "event": "a.x", "target": ["#s4"], "internal": true },
              {
                "event": "d",
                "guard": { "in": "#s1.s3" },
                "target": ["#s1.s2"],
                "internal": true
              }
            ]
          },
          { "id": "s3", "kind": "final" }
        ],
        "on": [
          { "event": "d" },
          {
            "event": "c",
            "target": ["#s1.s2"],
            "actions": [
              { "raise": { "event": "d" } },
              { "raise": { "event": "d" } }
            ]
          },
          {
            "event": "c",
            "target": ["#s1.s3"],
            "actions": [
              {
                "assign": {
                  "path": "/n",
                  "value": { "add": [{ "ctx": "/n" }, { "lit": 1 }] }
                }
              },
              { "emit": { "name": "e1" } }
            ]
          }
        ]
      },
      {
        "id": "s4",
        "on": [
          {
            "event": "a.x",
            "target": ["#s1.s3"],
            "actions": [
              { "assign": { "path": "/last", "value": { "event": "/v" } } },
              { "assign": { "path": "/last", "value": { "event": "/v" } } }
            ]
          },
          {
            "event": "c",
            "guard": { "in": "#s1" },
            "target": ["#s4"],
            "actions": [
              {
                "raise": { "event": "a", "data": { "lit": { "v": "raised" } } }
              }
            ]
          },
          {
            "event": "b",
            "target": ["#s1.s3"],
            "actions": [
              {
                "assign": {
                  "path": "/n",
                  "value": { "add": [{ "ctx": "/n" }, { "lit": 1 }] }
                }
              },
              {
                "assign": {
                  "path": "/seen/y~0",
                  "value": { "sub": [{ "ctx": "/n" }, { "lit": 0.5 }] }
                }
              }
            ]
          }
        ]
      }
    ]
  }
}
