{"schema":"foldstate/1","id":"generated","context":{"n":0},"max_microsteps":40,"root":{"id":"root","kind":"compound","initial":"s2","states":[{"id":"s1","on":[{"event":"b","target":["#s2"],"actions":[{"assign":{"path":"/last","value":{"event":"/v"}}}]},{"event":"c","guard":{"all":[{"in":"#s1"},{"cmp":{"left":{"ctx":"/n"},"op":"eq","right":{"lit":2}}}]},"target":["#s2"]}]},{"id":"s2","on":[{"event":"*","target":["#s1"],"actions":[{"assign":{"path":"/n/x","value":{"lit":1}}},{"emit":{"name":"e0","params":{"ctx":"/n"}}}]},{"guard":{"cmp":{"left":{"ctx":"/n"},"op":"lt","right":{"lit":5}}},"target":["#s1"],"actions":[{"assign":{"path":"/n","value":{"add":[{"ctx":"/n"},{"lit":1}]}}},{"raise":{"event":"c","data":{"lit":{"v":"raised"}}}}]}]}],"on":[{"event":"i","guard":{"in":"#s2"},"target":["#s2"],"actions":[{"assign":{"path":"/n","value":{"mul":[{"ctx":"/n"},{"lit":3037000500}]}}}]}],"tags":["tagged"]}}