{"schema":"foldstate/1","id":"generated","context":{"n":0},"unhandled":"ignore","max_microsteps":40,"root":{"id":"root","kind":"compound","states":[{"id":"s1","on":[{"event":"c","target":["#s4"],"actions":[{"emit":{"name":"e1","params":{"ctx":"/n"}}}]},{"event":"b","target":["#s4"]}],"exit":[{"assign":{"path":"/last","value":{"event":"/v"}}},{"assign":{"path":"/n/x","value":{"lit":1}}}],"invoke":[{"name":"job","params":{"ctx":"/n"}}]},{"id":"s2","on":[{"event":"a.x","guard":{"in":"#s2"},"target":["#s4"]},{"event":"a.x","target":["#s3"]}],"exit":[{"assign":{"path":"/seen/x","value":{"sub":[{"ctx":"/n"},{"lit":0.5}]}}},{"assign":{"path":"/seen/x","value":{"sub":[{"ctx":"/n"},{"lit":0.5}]}}}]},{"id":"s4","kind":"history","default":["#s2"]},{"id":"s3","kind":"final"}],"tags":["tagged"]}}